<?xml version="1.0" encoding="UTF-8"?>
<xs:schema xmlns:xs="http://www.w3.org/2001/XMLSchema" elementFormDefault="qualified" attributeFormDefault="unqualified">
	<xs:element name="Providers">
		<xs:complexType>
			<xs:sequence minOccurs="0" maxOccurs="unbounded">
				<xs:element name="Provider">
					<xs:complexType>
						<xs:sequence>
							<xs:element name="name">
								<xs:simpleType>
									<xs:restriction base="xs:string">
										<xs:maxLength value="25"/>
									</xs:restriction>
								</xs:simpleType>
							</xs:element>
							<xs:element name="address">
								<xs:simpleType>
									<xs:restriction base="xs:string">
										<xs:maxLength value="25"/>
									</xs:restriction>
								</xs:simpleType>
							</xs:element>
							<xs:element name="city">
								<xs:simpleType>
									<xs:restriction base="xs:string">
										<xs:maxLength value="14"/>
									</xs:restriction>
								</xs:simpleType>
							</xs:element>
							<xs:element name="country">
								<xs:simpleType>
									<xs:restriction base="xs:string">
										<xs:maxLength value="2"/>
									</xs:restriction>
								</xs:simpleType>
							</xs:element>
							<xs:element name="zip">
								<xs:simpleType>
									<xs:restriction base="xs:string">
										<xs:length value="5"/>
									</xs:restriction>
								</xs:simpleType>
							</xs:element>
							<xs:element name="email" type="xs:string"/>
							<xs:element name="type">
								<xs:simpleType>
									<xs:restriction base="xs:string">
										<xs:pattern value="I"/>
										<xs:pattern value="D"/>
										<xs:pattern value="E"/>
									</xs:restriction>
								</xs:simpleType>
							</xs:element>
						</xs:sequence>
						<xs:attribute name="number" use="required">
							<xs:simpleType>
								<xs:restriction base="xs:string">
									<xs:length value="9"/>
								</xs:restriction>
							</xs:simpleType>
						</xs:attribute>
					</xs:complexType>
				</xs:element>
			</xs:sequence>
		</xs:complexType>
	</xs:element>
</xs:schema>